{
  "$schema": "https://json-schema.org/draft/2020-12/schema",
  "$id": "https://local.yxj/ppg-material.schema.json",
  "title": "PPG Material Version",
  "description": "First-class versioned paper-production material envelope. Phase 2 contract only; executable validation is implemented in scripts/validate_graph.py.",
  "type": "object",
  "required": ["schema_version", "material_id", "version", "status", "material_type"],
  "properties": {
    "schema_version": { "const": "ppg-material/v0.1" },
    "material_id": {
      "type": "string",
      "minLength": 1,
      "description": "Logical material identity shared by versions, e.g. claim_boundary_map."
    },
    "version": {
      "type": "string",
      "minLength": 1,
      "description": "Material version label, e.g. v1, v2, or v3-candidate."
    },
    "status": {
      "enum": ["planned", "candidate", "validated", "committed", "stale", "rejected", "blocked", "owner_gated"]
    },
    "material_type": {
      "type": "string",
      "minLength": 1,
      "description": "Domain payload type, e.g. EvidenceInventory, ClaimBoundaryMap, ReaderSpine."
    },
    "supersedes": {
      "type": "string",
      "description": "Concrete node id of the old version superseded by this version. Direction: new -> old."
    },
    "candidate_for": {
      "type": "string",
      "description": "Logical material id this candidate proposes to replace. Candidates cannot be active."
    },
    "artifact_path": { "type": "string" },
    "summary": { "type": "string" },
    "payload": { "type": "object" }
  },
  "additionalProperties": true
}
